term,subject,course_number,course_code_full,course_title,units,course_info,sec,class_number,section_uid,no_material_cost,reserve_capacity,class_notes_ref,type,days,time,open_seats,location,instructor,comment
Spring_2026,AAAS,100,AAAS 100,ASIAN EATS,3,GE: 3B (C2),01,3677,Spring_2026|AAAS 100|01|3677,FALSE,\N,305,LEC,NA,NA,,ONLINE-ONLY,Zimmerman-Liu T,Class instruction is: Asynch. Online-No Meet Times.
Spring_2026,AAAS,100,AAAS 100,ASIAN EATS,3,GE: 3B (C2),02,4116,Spring_2026|AAAS 100|02|4116,FALSE,\N,305,LEC,NA,NA,,ONLINE-ONLY,Zimmerman-Liu T,Class instruction is: Asynch. Online-No Meet Times.
Spring_2026,AAAS,100,AAAS 100,ASIAN EATS,3,GE: 3B (C2),03,6767,Spring_2026|AAAS 100|03|6767,FALSE,\N,305,LEC,NA,NA,,ONLINE-ONLY,Nguyen J,Class instruction is: Asynch. Online-No Meet Times.
Spring_2026,AAAS,100,AAAS 100,ASIAN EATS,3,GE: 3B (C2),04,5991,Spring_2026|AAAS 100|04|5991,FALSE,\N,"310,34",LEC,TuTh,2-3:15PM,,HHS1-100,Tran A,Honors SectionClass instruction is: Face to Face - On Campus.
Spring_2026,AAAS,492,AAAS 492,SENIOR RESEARCH SEMINAR,3,,01,4536,Spring_2026|AAAS 492|01|4536,FALSE,\N,310,LEC,MW,12:30-1:45PM,available,LA1-302,Zeiser J,Class instruction is: Face to Face - On Campus.
